<?xml version="1.0" encoding="UTF-8"?>
<!DOCTYPE locale SYSTEM "../../../schemas/locale.dtd">
<locale lang="en" deck="standard-playing">
  <card id="h01"><title>Ace of Hearts</title><description><p>The highest card in the hearts suit.</p></description></card>
  <card id="h13"><title>King of Hearts</title><description><p>The king of hearts.</p></description></card>
</locale>
